{
  "account": "acme-org",
  "repository": "acme-org/widgets",
  "requiredScopes": ["repo"],
  "codeSafety": { "mode": "ensure" },
  "labels": {
    "kind:bug": {
      "color": "D73A4A",
      "description": "Defect report",
      "managed": true
    },
    "kind:feature": {
      "color": "1D76DB",
      "description": "Feature request",
      "managed": true
    }
  },
  "templates": {
    "issueForms": ["bug_report", "feature_request"],
    "issueFormLabels": {
      "bug_report": ["kind:bug"],
      "feature_request": ["kind:feature"]
    },
    "pullRequest": true,
    "mode": "ensure"
  }
}
